{
  "name": "Smoke test",
  "arena": "practice",
  "meshPath": "engine/assets/collision_meshes",
  "device": "cpu",
  "observation": "advanced_v1",
  "teamSize": 1,
  "arenas": 2,
  "threads": 2,
  "tickSkip": 8,
  "actionDelayTicks": 7,
  "rolloutSteps": 8,
  "iterations": 2,
  "epochs": 1,
  "minibatchSize": 32,
  "hiddenSize": 32,
  "seed": 42,
  "checkpointEvery": 1,
  "learningRate": 0.00015,
  "gamma": 0.99,
  "gaeLambda": 0.95,
  "clipRange": 0.2,
  "entropyCoef": 0.03,
  "valueCoef": 0.5,
  "maxGradNorm": 0.5,
  "episodeSeconds": 60,
  "noTouchSeconds": 30,
  "velocityToBall": 4,
  "faceBall": 0.25,
  "ballToGoal": 2,
  "saveBoost": 0.2,
  "airTime": 0,
  "touch": 5,
  "boostPickup": 10,
  "goal": 150
}
