{
  "name": "3v3 Competitive",
  "arena": "accurate",
  "meshPath": "engine/assets/collision_meshes",
  "device": "cuda",
  "observation": "advanced_v1",
  "teamSize": 3,
  "arenas": 256,
  "threads": 32,
  "tickSkip": 8,
  "actionDelayTicks": 7,
  "rolloutSteps": 512,
  "iterations": 2000,
  "epochs": 3,
  "minibatchSize": 32768,
  "hiddenSize": 512,
  "seed": 42,
  "checkpointEvery": 50,
  "learningRate": 0.00015,
  "gamma": 0.995,
  "gaeLambda": 0.95,
  "clipRange": 0.2,
  "entropyCoef": 0.015,
  "valueCoef": 0.5,
  "maxGradNorm": 0.5,
  "episodeSeconds": 300,
  "noTouchSeconds": 20,
  "velocityToBall": 1.25,
  "faceBall": 0,
  "ballToGoal": 3.5,
  "saveBoost": 0.1,
  "airTime": 0,
  "touch": 5.0,
  "boostPickup": 8.0,
  "goal": 150.0
}
